{
  "slug": "site-guardian",
  "name": "Site Guardian",
  "description": "Real-time site health scoring, backup freshness alerts, scheduled email digests and a REST status API - zero configuration needed.",
  "namespace": "AnsariAi\\SiteGuardian",
  "prefix": "sguard",
  "textDomain": "site-guardian",
  "version": "1.0.0",
  "author": {
    "name": "Mohammad Ansari",
    "uri": "https://ansariai.ir"
  },
  "requires": {
    "php": "8.1",
    "wp": "6.4"
  },
  "license": {
    "enabled": false,
    "server": "https://ansariai.ir/api/v1",
    "productId": "site-guardian"
  },
  "modules": [
    "settings-page",
    "health-scan",
    "backup-alert",
    "email-notify",
    "rest-api",
    "scheduler",
    "cron-report",
    "csv-export"
  ],
  "options": [
    {
      "key": "report_email",
      "type": "email",
      "label": "Digest recipient",
      "default": "",
      "tab": "reports"
    },
    {
      "key": "scan_interval_hours",
      "type": "number",
      "label": "Scan interval (hours)",
      "default": "24",
      "choices": [],
      "tab": "health"
    },
    {
      "key": "backup_alert_email",
      "type": "email",
      "label": "Alert email",
      "default": "",
      "choices": [],
      "tab": "backup"
    },
    {
      "key": "backup_max_age_days",
      "type": "number",
      "label": "Max backup age (days)",
      "default": "7",
      "choices": [],
      "tab": "backup"
    },
    {
      "key": "backup_time_option",
      "type": "text",
      "label": "Option name holding last-backup Unix timestamp",
      "default": "{{PREFIX}}_last_backup_at",
      "choices": [],
      "tab": "backup"
    }
  ],
  "features": [
    "Health score dashboard widget with weighted checks",
    "Backup staleness detection with throttled email alerts and SMS hook"
  ],
  "glueClass": "Glue"
}
