{
  "slug": "store-health",
  "name": "Store Health Assistant",
  "description": "Daily WooCommerce store health digest with configurable alert thresholds.",
  "namespace": "AnsariAi\\StoreHealth",
  "prefix": "ansariai_sh",
  "textDomain": "store-health",
  "version": "1.0.0",
  "author": {
    "name": "AnsariAi",
    "uri": "https://ansariai.ir"
  },
  "requires": {
    "php": "8.1",
    "wp": "6.8",
    "woo": "9.0"
  },
  "license": {
    "enabled": true,
    "server": "https://ansariai.ir/api/v1",
    "productId": "store-health"
  },
  "modules": [
    "settings-page",
    "scheduler",
    "db-table",
    "rest-api",
    "email-notify",
    "csv-export",
    "cron-report",
    "license-client"
  ],
  "options": [
    {
      "key": "report_email",
      "type": "email",
      "label": "Report recipient",
      "default": "",
      "tab": "general"
    },
    {
      "key": "low_stock_threshold",
      "type": "number",
      "label": "Low stock threshold",
      "default": 5,
      "tab": "general"
    },
    {
      "key": "enable_daily_digest",
      "type": "checkbox",
      "label": "Send daily digest",
      "default": true,
      "tab": "general"
    }
  ],
  "features": [
    "Once a day, collect order count/revenue for the last 24h, low-stock product count, and failed-payment count, then email the report_email address using the email-notify module and store a CSV snapshot via csv-export.",
    "Expose a read-only REST endpoint (rest-api module) at /wp-json/store-health/v1/summary returning the same metrics as JSON for dashboard widgets, gated by the manage_woocommerce capability."
  ]
}
